{
  "ID": "Mossbone Mother",
  "DisplayName": "Moss Mother",
  "ArenaSceneName": "Tut_03",
  "ArenaPosition": {
    "x": 68.0,
    "y": 17.6,
    "z": 0.0
  },
  "CanRespawnOnArena": true,
  "RequireHardSceneReload": true,

  "RespawnFlags": {
    "PlayerDataBools": {
      "defeatedMossMother": false,
      "spinnerDefeated": false
    },

    "SceneBools": [
      {
        "SceneName": "Tut_03",
        "ID": "Battle Scene",
        "Value": false
      }
    ],
    "SceneInts": []
  }
}