{
  "ID": "Lace Boss1",
  "DisplayName": "Lace 1",
  "ArenaSceneName": "Bone_East_12",
  "ArenaPosition": {
    "x": 90.0,
    "y": 7.57,
    "z": 0.0
  },
  "CanRespawnOnArena": true,
  "RequireHardSceneReload": true,

  "RespawnFlags": {
    "PlayerDataBools": {
      "defeatedLace1": false
    },
    "SceneBools": [],
    "SceneInts": []
  }
}