{
  "ID": "Bone Beast",
  "DisplayName": "Bell Beast",
  "ArenaSceneName": "Bone_05",
  "ArenaPosition": {
    "x": 78.59,
    "y": 3.57,
    "z": 0.0
  },
  "CanRespawnOnArena": true,
  "RequireHardSceneReload": true,

  "RespawnFlags": {
    "PlayerDataBools": {
      "defeatedBellBeast": false
    },
    "SceneBools": [],
    "SceneInts": []
  }
}