{
  "ID": "Spinner Boss",
  "DisplayName": "Widow",
  "ArenaSceneName": "Belltown_Shrine",
  "ArenaPosition": {
    "x": 52.4,
    "y": 8.6,
    "z": 0.0
  },
  "CanRespawnOnArena": true,
  "RequireHardSceneReload": true,

  "RespawnFlags": {
    "PlayerDataBools": {
      "spinnerDefeated": false,
      "encounteredSpinner": true,
      "bellShrineBellhart": false
    },
    "SceneBools": [],
    "SceneInts": [
      {
        "SceneName": "Belltown_Shrine",
        "ID": "Bellshrine Sequence Bellhart",
        "Value": 0,
        "Mutator": 0
      }
    ]
  }
}